{
  "transaction_id": 101,
  "external_ref": "SMS123456789",
  "sender_id": 1,
  "receiver_id": 2,
  "category_id": 1,
  "amount": 1500.50,
  "currency": "RWF",
  "transaction_date": "2025-09-15T14:20:00Z",
  "status": "Success",
  "message": "Payment for airtime",
  "created_at": "2025-09-15T14:21:00Z"
}
